score total:,62,
Question,"Score: zero (none), one (a litte), two (somewhat), three (a lot).",Evidence
Video,3,GH readme: https://github.com/lyonva/ClassMateBot/blob/main/README.md
"Workload is spread over the whole team (one team member is often Xtimes more productive than the others...but nevertheless, here is a track record that everyone is contributing a lot)",2,https://github.com/lyonva/ClassMateBot/graphs/contributors: Evenly distributed mostly
Number of commits,3,Alteast 181 commits were made
Number of commits: by different people,3,https://github.com/SE21-Team2/ClassMateBot/graphs/contributors
Issues reports: there are many,3,https://github.com/lyonva/ClassMateBot/issues:  Total issues: 22
Issues are being closed,3,12 closed: https://github.com/lyonva/ClassMateBot/issues 
DOI badge: exists,3,GH readme: https://github.com/lyonva/ClassMateBot/blob/main/README.md : doi exists
"Docs: doco generated, format not ugly",3,GH readme: https://github.com/lyonva/ClassMateBot/blob/main/README.md: Not ugly
Docs: what: point descriptions of each class/function (in isolation),3,https://github.com/lyonva/ClassMateBot/blob/main/README.md : Each function is described with photos.
"Docs: how: for common use cases X,Y,Z mini-tutorials showing worked examples on how to do X,Y,Z",3,https://github.com/lyonva/ClassMateBot/blob/main/README.md : GH readme description
"Docs: why: docs tell a story, motivate the whole thing, deliver a punchline that makes you want to rush out and use the thing",3,Video sells the product: https://github.com/lyonva/ClassMateBot/blob/main/README.md
"Docs: short video, animated, hosted on your repo. That convinces people why they want to work on your code.",3,yes: https://github.com/lyonva/ClassMateBot/blob/main/README.md
Use of version control tools,3,Project hosted on github
Use of style checkers,0,none
Use of code formatters.,0,none
Use of syntax checkers.,0,none
Use of code coverage: ,2,56% : https://app.codecov.io/gh/lyonva/ClassMateBot
Other automated analysis tools,1,Some linting is there
Test cases exist,3,Great testing: https://github.com/lyonva/ClassMateBot/blob/main/test/test_bot.py
test scheduled?,0,no evidence
The files CONTRIBUTING.md lists coding standards and lots of tips on how to extend the system without screwing things up,3,provided: https://github.com/lyonva/ClassMateBot/blob/main/CONTRIBUTING.md
Issues are discussed before they are closed,0,Issues not discussed on github
Chat channel: exists,0,No link provided
Test cases: a large proportion of the issues related to handling failing cases.,0,GH: no issues opened for failed issues
Evidence that the whole team is using the same tools: everyone can get to all tools and files,3,"Yes, .vscode and .idea files included"
"Evidence that the whole team is using the same tools (e.g. config files in the repo, updated by lots of different people)",3,Yes : https://github.com/lyonva/ClassMateBot/blob/main/requirements.txt
"Evidence that the whole team is using the same tools (e.g. tutor can ask anyone to share screen, they demonstrate the system running on their computer)",0,No evidence 
Evidence that the members of the team are working across multiple places in the code base,3,yes: https://github.com/lyonva/ClassMateBot/commits/main
Short release cycles,0,no: https://github.com/lyonva/ClassMateBot/releases/tag/v2.9
"Does your website and documentation provide a clear, high-level overview of your software?",3,yes: https://github.com/lyonva/ClassMateBot/blob/main/README.md
Does your website and documentation clearly describe the type of user who should use your software?,3,https://github.com/lyonva/ClassMateBot/blob/main/README.md
Sustainability Questions,,
Question 1.3: Do you publish case studies to show how your software has been used by yourself and others? ,y,Video provided: https://github.com/deekay2310/calorieApp_server/blob/main/README.md
Question 2.1: Is the name of your project/software unique?*,n,"No, many found by same name"
Question 2.2: Is your project/software name free from trademark violations?,y,yes
Question 3.1: Is your software available as a package that can be deployed without building it?,n,https://github.com/lyonva/ClassMateBot/blob/main/docs/installation.md
Question 3.2: Is your software available for free?*,y,Yes it is open source
"Question 3.3: Is your source code publicly available to download, either as a downloadable bundle or via access to a source code repository?",y,Yes it is open source
"Question 3.4: Is your software hosted in an established, third-party repository likeGitHub (https://github.com), BitBucket (https://bitbucket.org),LaunchPad (https://launchpad.net) orSourceForge (https://sourceforge.net)?",y,Yes it uses github
Question 4.1: Is your documentation clearly available on your website or within your software?,y,Yes it is available on github readme: https://github.com/lyonva/ClassMateBot/blob/main/README.md
"Question 4.2: Does your documentation include a ""quick start"" guide, that provides a short overview of how to use your software with some basic examples of use?",y,Yes detailed explanation for each command: https://github.com/lyonva/ClassMateBot/blob/main/README.md
"Question 4.3: If you provide more extensive documentation, does this provide clear, step-by-step instructions on how to deploy and use your software?",y,Yes installation steps given: https://github.com/lyonva/ClassMateBot/blob/main/README.md
"Question 4.4: Do you provide a comprehensive guide to all your software’s commands, functions and options?",y,Yes detailed explanation for each command: https://github.com/lyonva/ClassMateBot/blob/main/README.md
Question 4.5: Do you provide troubleshooting information that describes the symptoms and step-by-step solutions for problems and error messages?,n,No such thing
"Question 4.6: If your software can be used as a library, package or service by other software, do you provide comprehensive API documentation?",n,No API
Question 4.7: Do you store your documentation under revision control with your source code?,y,Yes their documentation is the readme file on github: https://github.com/lyonva/ClassMateBot/blob/main/README.md
"Question 4.8: Do you publish your release history e.g. release data, version numbers, key features of each release etc. on your web site or in your documentation?",y,Yes: https://github.com/lyonva/ClassMateBot/releases
Question 5.1: Does your software describe how a user can get help with using your software?,n,no
"Question 5.2: Does your website and documentation describe what support, if any, you provide to users and developers?",n,No support
Question 5.3: Does your project have an e-mail address or forum that is solely for supporting users?,n,no
Question 5.4: Are e-mails to your support e-mail address received by more than one person?,n,no
Question 5.5: Does your project have a ticketing system to manage bug reports and feature requests?,y,Links for  bug reports given : https://github.com/lyonva/ClassMateBot/blob/main/CONTRIBUTING.md#reporting-bugs
"Question 5.6: Is your project's ticketing system publicly visible to your users, so they can view bug reports and feature requests? ",y,Publicly visible
Question 6.1: Is your software’s architecture and design modular?,y,Project structure and Modularity is decent
Question 6.2: Does your software use an accepted coding standard or convention?,y,Linting and some project structure is present
"Question 7.1: Does your software allow data to be imported and exported using open data formats? *e.g. GIF, SVG, HTML, XML, tar, zip, CSV, JSON, NetCDF, or domain specific ones",y,There are csv files to import data
"Question 7.2: Does your software allow communications using open communications protocols? *e.g. HTTP, FTP, XMPP, SOAP over HTTP,  or domain-specific ones",y,Rest APIs are being used in the project for communication from backend to frontend and vice versa
"Question 8.1: Is your software cross-platform compatible? *e.g. does it run under two or more of Windows, Unix/Linux and Mac OS X, or can be used from within two or more of Internet Explorer, Chrome, Firefox and Safari?",y,Software is available as a discord bot which can be run on most popular browsers
Question 9.1: Does your software adhere to appropriate accessibility conventions or standards?,y,yes
Question 9.2: Does your documentation adhere to appropriate accessibility conventions or standards?,n,No documentation regarding this
Question 10.1: Is your source code stored in a repository under revision control?,y,Github
Question 10.2: Is each source code release a snapshot of the repository?,y,"Yes, source code .zip files: https://github.com/lyonva/ClassMateBot/releases"
Question 10.3: Are releases tagged in the repository?,y,Yes: https://github.com/lyonva/ClassMateBot/tags
"Question 10.4: Is there a branch of the repository that is always stable? (i.e. tests always pass, code always builds successfully) *",y,"Yes, main CI status is always Complete: https://app.codecov.io/gh/lyonva/ClassMateBot/commits"
Question 10.5: Do you back-up your repository?,n,No evidence
Question 11.1: Do you provide publicly-available instructions for building your software from the source code?,y,Yes: https://github.com/lyonva/ClassMateBot#arrow_down-installation
"Question 11.2: Can you build, or package, your software using an automated tool? *e.g. Make (https://www.gnu.org/software/make/), ANT (http://ant.apache.org/), Maven (https://maven.apache.org/), CMake (https://cmake.org/), Python setuptools (https://pypi.python.org/pypi/setuptools), or R package tools (https://cran.r-project.org/doc/manuals/r-devel/R-exts.html)?",y,"Yes, codecov"
Question 11.3: Do you provide publicly-available instructions for deploying your software?,n,There are no docs to how to deploy the repository
Question 11.4: Does your documentation list all third-party dependencies?,y,There is a requirements file 
Question 11.5: Does your documentation list the version number for all third-party dependencies?,y,The requirements file lists all the version numbers
"Question 11.6: Does your software list the web address, and licences for all third-party dependencies and say whether the dependencies are mandatory or optional?",n,no
"Question 11.7: Can you download dependencies using a dependency management tool or package manager? *e.g. Ivy (http://ant.apache.org/ivy/), Maven (https://maven.apache.org/), Python pip (https://pypi.python.org/pypi/pip) or setuptools (https://pypi.python.org/pypi/setuptools), PHP Composer (https://getcomposer.org/), Ruby gems (https://rubygems.org), or R PackRat (https://rstudio.github.io/packrat/)",y,Yes PIP is used
Question 11.8: Do you have tests that can be run after your software has been built or deployed to show whether the build or deployment has been successful?,y,"Yes, codecov"
Question 12.1: Do you have an automated test suite for your software?,n,no
Question 12.2: Do you have a framework to periodically (e.g. nightly) run your tests on the latest version of the source code?,n,No periodical schedule to main.yml
"Question 12.3: Do you use continuous integration, automatically running tests whenever changes are made to your source code?",y,Yes : https://github.com/lyonva/ClassMateBot/blob/main/.github/workflows/main.yml
Question 12.4: Are your test results publicly visible?,y,Yes: https://app.codecov.io/gh/lyonva/ClassMateBot/commits
Question 12.5: Are all manually-run tests documented?,n,No manually test run document is available
"Question 13.1: Does your project have resources (e.g. blog, Twitter, RSS feed, Facebook page, wiki, mailing list) that are regularly updated with information about your software? * e.g. release announcements, publications, workshops, conference presentations",n,No such resources
Question 13.2: Does your website state how many projects and users are associated with your project?,y,Yes: Photos of all contributors are shown in readme
Question 13.3: Do you provide success stories on your website?,n,No evidence of success stories
Question 13.4: Do you list your important partners and collaborators on your website?,y,Yes collaborators are mentioned
Question 13.5: Do you list your project's publications on your website or link to a resource where these are available?,n,No evidence
Question 13.6: Do you list third-party publications that refer to your software on your website or link to a resource where these are available?,n,"NA, no evidence of third party publications"
Question 13.7: Can users subscribe to notifications to changes to your source code repository?,y,Github by default allows subscriptions
"Question 13.8: If your software is developed as an open source project (and, not just a project developing open source software), do you have a governance model?",n,no
"Question 14.1: Do you accept contributions (e.g. bug fixes, enhancements, documentation updates, tutorials) from people who are not part of your project?",y,Yes: https://github.com/lyonva/ClassMateBot/blob/main/CONTRIBUTING.md
Question 14.2: Do you have a contributions policy?,y,Yes: https://github.com/lyonva/ClassMateBot/blob/main/CONTRIBUTING.md
Question 14.3: Is your contributions' policy publicly available?,y,Yes : https://github.com/lyonva/ClassMateBot/blob/main/CONTRIBUTING.md
Question 14.4: Do contributors keep the copyright/IP of their contributions?,n,no
Question 15.1: Does your website and documentation clearly state the copyright owners of your software and documentation?,n,no
Question 15.2: Does each of your source code files include a copyright statement?,n,no
Question 15.3: Does your website and documentation clearly state the licence of your software?,y,Yes: https://github.com/lyonva/ClassMateBot/blob/main/LICENSE
Question 15.4: Is your software released under an open source licence?,y,"Yes, MIT License"
Question 15.5: Is your software released under an OSI-approved open-source licence?,y,yes
Question 15.6: Does each of your source code files include a licence header?,n,no
Question 15.7: Do you have a recommended citation for your software?,y,https://github.com/lyonva/ClassMateBot/blob/main/CITATION.md
"Question 16.1: Does your website or documentation include a project roadmap (a list of project and development milestones for the next 3, 6 and 12 months)?",n,No evidence as such
"Question 16.2: Does your website or documentation describe how your project is funded, and the period over which funding is guaranteed?",n,Not a funded project
"Question 16.3: Do you make timely announcements of the deprecation of components, APIs, etc.?",n,No such announcements
